{
  "persona_name": "gaearon",
  "timestamp": "2026-06-11T08:42:53Z",
  "sources_processed": [
    "search-results.json",
    "decisions.md",
    "github-profile.json",
    "code-patterns.md",
    "gotchas.md"
  ],
  "expertise": [
    {
      "domain": "react",
      "level": "expert",
      "evidence": [
        "decisions-extra: 4 mentions",
        "gotchas-extra: 3 mentions",
        "writings-extra: 13 mentions"
      ]
    },
    {
      "domain": "performance",
      "level": "expert",
      "evidence": [
        "decisions-extra: 2 mentions",
        "gotchas-extra: 6 mentions",
        "writings-extra: 3 mentions"
      ]
    },
    {
      "domain": "git",
      "level": "expert",
      "evidence": [
        "code-patterns: 3 mentions",
        "decisions: 3 mentions",
        "search-results: 3 mentions"
      ]
    },
    {
      "domain": "javascript",
      "level": "expert",
      "evidence": [
        "github-repos: 9 mentions"
      ]
    },
    {
      "domain": "design",
      "level": "proficient",
      "evidence": [
        "decisions-extra: 1 mentions",
        "gotchas-extra: 1 mentions",
        "writings-extra: 2 mentions"
      ]
    },
    {
      "domain": "typescript",
      "level": "proficient",
      "evidence": [
        "writings-extra: 1 mentions",
        "github-repos: 3 mentions"
      ]
    },
    {
      "domain": "writing / technical writing",
      "level": "proficient",
      "evidence": [
        "decisions-extra: 1 mentions",
        "writings-extra: 2 mentions",
        "github-repos: 1 mentions"
      ]
    },
    {
      "domain": "frontend",
      "level": "proficient",
      "evidence": [
        "gotchas-extra: 1 mentions",
        "writings-extra: 1 mentions",
        "github-repos: 1 mentions"
      ]
    },
    {
      "domain": "databases",
      "level": "proficient",
      "evidence": [
        "decisions-extra: 1 mentions",
        "writings-extra: 2 mentions"
      ]
    },
    {
      "domain": "security",
      "level": "proficient",
      "evidence": [
        "gotchas-extra: 3 mentions"
      ]
    }
  ],
  "heuristics": [],
  "style": {
    "formality": 3,
    "phrases": [
      "props and state",
      "stars language javascript",
      "language javascript description",
      "f data state",
      "it must run",
      "the duplicated logic",
      "doesn t mean",
      "the limits of",
      "limits of my",
      "gaearon dan github"
    ],
    "patterns": [
      "balanced",
      "uses-rhetorical-questions"
    ],
    "explanation_style": "first-principles",
    "dimensions": {
      "sentence_variety": "high-variety",
      "vocabulary_richness": "repetitive",
      "passive_voice_ratio": "low-passive",
      "hedging_frequency": "low-hedging",
      "first_person_ratio": "low",
      "technical_density": "low",
      "imperative_frequency": 5,
      "question_frequency": 19
    }
  },
  "tools": [
    {
      "name": "Docker",
      "usage": "",
      "source": "keyword:docker"
    },
    {
      "name": "GitHub CLI",
      "usage": "",
      "source": "keyword:gh "
    }
  ],
  "gotchas": [
    {
      "pattern": "fetching {id: 10}, switching to {id: 20}, but the response for {id:10} arrives second, overwriting the {id:20} data. Fix: use the didCancel pattern — set a flag in the cleanup that the async handler checks before setting state.",
      "fix": "Fix: use the didCancel pattern — set a flag in the cleanup that the async handler checks before setting state.",
      "source": "text-extraction"
    },
    {
      "pattern": "\"If you're trying to write an effect that behaves differently depending on whether the component renders for the first time or not, you're swimming against the tide!\"",
      "fix": "",
      "source": "text-extraction"
    },
    {
      "pattern": "\"Vulnerability\" does not equal actual risk. A ReDoS in a build-time CSS parser is not a threat if the parser never touches untrusted input. Always ask: Can an attacker influence the input that reaches this code path?",
      "fix": "",
      "source": "text-extraction"
    },
    {
      "pattern": "using state variable directly in setInterval with empty deps array. The count variable is captured from the first render and never updates. Fix: use functional updater form setCount(c => c + 1) which eliminates the dependency entirely. Every render gets its own isolated snapshot of props and state.",
      "fix": "",
      "source": "text-extraction"
    },
    {
      "pattern": "read that state, the state likely lives too high",
      "fix": "",
      "source": "negative-pattern"
    },
    {
      "pattern": "lift state higher than necessary",
      "fix": "",
      "source": "negative-pattern"
    },
    {
      "pattern": "react immediately",
      "fix": "",
      "source": "negative-pattern"
    },
    {
      "pattern": "correspond to real problems",
      "fix": "",
      "source": "negative-pattern"
    },
    {
      "pattern": "confuse aesthetic qualities with engineering outcomes",
      "fix": "",
      "source": "negative-pattern"
    },
    {
      "pattern": "touches untrusted input",
      "fix": "",
      "source": "negative-pattern"
    },
    {
      "pattern": "optimize prematurely",
      "fix": "",
      "source": "negative-pattern"
    },
    {
      "pattern": "trust my judgement, why are you running my code on your computer?\" Package maintainers should be able to mark vulnerabilities",
      "fix": "",
      "source": "negative-pattern"
    },
    {
      "pattern": "Stop the Data Flow",
      "fix": "",
      "source": "negative-pattern"
    },
    {
      "pattern": "copy props into state",
      "fix": "",
      "source": "negative-pattern"
    },
    {
      "pattern": "Repeat Yourself) inevitably leads to software we can't understand",
      "fix": "",
      "source": "negative-pattern"
    }
  ],
  "canon": [
    {
      "title": "https://github.com/gaearon",
      "type": "url",
      "cited_in": []
    },
    {
      "title": "Let clean code guide you. Then let it go.",
      "type": "unknown",
      "cited_in": []
    },
    {
      "title": "If this component was rendered twice, should this interaction reflect in the other copy?",
      "type": "unknown",
      "cited_in": []
    },
    {
      "title": "Does the duplicated logic represent a stable, understood concept whose variations are known?",
      "type": "unknown",
      "cited_in": []
    },
    {
      "title": "right time",
      "type": "unknown",
      "cited_in": []
    },
    {
      "title": "I am able to learn things when I need them. That's fine.",
      "type": "unknown",
      "cited_in": []
    }
  ],
  "contradictions": [],
  "confidence": {
    "expertise": "high",
    "heuristics": "low",
    "style": "high",
    "gotchas": "high"
  }
}